{
  "id": "core.care_stay",
  "version": 4,
  "readiness": "ready",
  "onlineBooking": "ready",
  "labels": {
    "pl": {
      "name": "Pobyt z opieką",
      "description": "Hotel dla zwierząt, przechowalnia, parking: miejsce z puli na doby. O to, kogo lub co przyjmujecie, formularz pyta osobnym polem. Klienci rezerwują przez stronę, zespół — w panelu."
    },
    "en": {
      "name": "Boarding and storage",
      "description": "Pet hotel, storage, parking: a place from a pool by the day. The booking form asks who or what is left in your care in a field of its own. Customers book through the site, the team in the panel."
    }
  },
  "timeModel": "range",
  "range": {
    "unit": "day",
    "startTime": "09:00",
    "endTime": "18:00"
  },
  "booked": {
    "subject": "unit_group",
    "staff": "none"
  },
  "quantity": "one",
  "participants": {
    "mode": "none"
  },
  "confirmation": "instant",
  "place": "business",
  "price": {
    "basis": "per_time_unit"
  },
  "payment": {
    "policy": "on_site"
  },
  "fields": [
    {
      "key": "ward",
      "type": "text",
      "mandatory": true,
      "labels": {
        "pl": "Kogo lub co przyjmujemy (np. imię i gatunek zwierzęcia, numer rejestracyjny)",
        "en": "Who or what we look after (e.g. the pet's name and species, a registration number)"
      }
    }
  ],
  "extras": [],
  "calendarSync": false,
  "vocabulary": {
    "pl": {
      "unit": "Miejsce",
      "units": "Miejsca",
      "booking": "Pobyt",
      "bookings": "Pobyty",
      "participant": "Klient",
      "participants": "Klienci",
      "timeUnit": "doba",
      "timeUnits": "doby"
    },
    "en": {
      "unit": "Place",
      "units": "Places",
      "booking": "Stay",
      "bookings": "Stays",
      "participant": "Customer",
      "participants": "Customers",
      "timeUnit": "day",
      "timeUnits": "days"
    }
  }
}
